{
  "suite_id": "chat01-qinweixi-v6",
  "schema_version": 1,
  "version": "v6",
  "status": "frozen",
  "created_at": "2026-08-07T17:41:13+08:00",
  "frozen_at": "2026-08-07T17:41:13+08:00",
  "owner": "AiPeople",
  "purpose": "FREEZE-02 contract refresh (2026-08-07): canonical source 设计文档/AI聊天核心施工优先级总纲.md updated externally; v6 re-freezes contract sources. Existing cases, oracles, and rubrics remain byte-identical to v5.",
  "schemas": {
    "case": "eval/chat01/schema/case.schema.json",
    "suite_manifest": "eval/chat01/schema/suite_manifest.schema.json",
    "auto_result": "eval/chat01/schema/auto_result.schema.json",
    "human_ballot": "eval/chat01/schema/human_ballot.schema.json",
    "canon_snapshot": "eval/chat01/schema/canon_snapshot.schema.json",
    "canon_drift": "eval/chat01/schema/canon_drift.schema.json",
    "blocker_rules": "eval/chat01/schema/blocker_rules.schema.json",
    "semantic_review": "eval/chat01/schema/semantic_review.schema.json",
    "quality_rubric": "eval/chat01/schema/quality_rubric.schema.json",
    "leakage_report": "eval/chat01h/leakage_report.schema.json"
  },
  "canonical_sources": [
    {
      "path": "需求文档/项目框架需求.md",
      "required": true,
      "bytes": 18591,
      "sha256": "d1a49ceb41f6d1e75c8515bffa89b0db662f81c3d7f3193b48d11d6c75a36757"
    },
    {
      "path": "人物设定/秦/角色设定定稿.md",
      "required": true,
      "bytes": 26406,
      "sha256": "2a2107ffb1c5e37fcc80e591704a7de43d21f13030a86b18135c454e7a5ba3f5"
    },
    {
      "path": "人物设定/秦/bible.yaml",
      "required": true,
      "bytes": 12689,
      "sha256": "e07f7226aa6ad9b122bd6f7e8d0cbca79aef91d2b4956863a4c4510a968b8b3b"
    },
    {
      "path": "人物设定/秦/canon.json",
      "required": true,
      "bytes": 5847,
      "sha256": "f8dcdc3e75c6433ef095800c76d9dd1bc7f2221da1d5ab8645701eabd0998530"
    },
    {
      "path": "人物设定/秦/timeline.yaml",
      "required": true,
      "bytes": 11283,
      "sha256": "c9de786b19de5bf08e9a9aca153a2db30394e5b2e66d79ca0cbf556a819bf2b5"
    },
    {
      "path": "设计文档/AI女友最小心智系统设计.md",
      "required": true,
      "bytes": 29327,
      "sha256": "a7f7c7da0b283708154b37410465885367792a55a16a9923c654f8cd58bc5697"
    },
    {
      "path": "设计文档/本地AI恋爱桌面宠物产品集成设计.md",
      "required": true,
      "bytes": 15909,
      "sha256": "4853760b8af06e7275c7aea5566be0b9695fe1ae521eaf31e189df206df016fa"
    },
    {
      "path": "设计文档/AI聊天核心施工优先级总纲.md",
      "required": true,
      "bytes": 29070,
      "sha256": "4ffc6ed17d8ce3aa8374e9e09fc1181936ff83aa97c5ef77fcc6cc947e97d9b7"
    }
  ],
  "assets": [
    {
      "split": "dev",
      "path": "eval/chat01/suites/chat01_dev_v1.jsonl",
      "minimum_cases": 80,
      "minimum_counts": {
        "case_types": {},
        "categories": {},
        "scenario_families": {}
      },
      "sha256": "f783e1f0112fdbb8e2b8d61080306806cb04b846de359382175e0e1465c24f5d"
    },
    {
      "split": "frozen_single",
      "path": "eval/chat01/suites/chat01_frozen_single_v1.jsonl",
      "minimum_cases": 240,
      "minimum_counts": {
        "case_types": {
          "single_turn": 240
        },
        "categories": {
          "identity_timeline": 40,
          "relationship_boundary": 32,
          "unknown_reality": 24,
          "safety_health": 24,
          "general_capability": 60,
          "daily_relevance": 20,
          "emotion": 20,
          "style": 20
        },
        "scenario_families": {}
      },
      "sha256": "a75f326a99cd83e77d795458b76cdcf93faae6d537d34cd02807c3f3afff3898"
    },
    {
      "split": "frozen_multiturn",
      "path": "eval/chat01/suites/chat01_frozen_multiturn_v1.jsonl",
      "minimum_cases": 30,
      "minimum_counts": {
        "case_types": {
          "multi_turn": 30
        },
        "categories": {},
        "scenario_families": {
          "topic_continuity": 6,
          "topic_switch": 5,
          "ambiguity_and_humor": 5,
          "emotion_and_stop_boundary": 5,
          "relationship_probe": 5,
          "injection_and_recovery": 4
        }
      },
      "sha256": "a4f0058a701754d8ca7e46cbc32d60780b9eaf4c019a5cfd52342fba0c7033d6"
    },
    {
      "split": "human_blind",
      "path": "eval/chat01/suites/chat01_human_blind_v1.jsonl",
      "minimum_cases": 68,
      "minimum_counts": {
        "case_types": {
          "human_pair": 60,
          "human_long_session": 8
        },
        "categories": {},
        "scenario_families": {}
      },
      "sha256": "cb2094cab0eb86fdacf6851a1b6ebbaeb08f8c268ff8ea37819be926e7f49966"
    }
  ],
  "rubrics": [
    "eval/chat01/rubrics/semantic_rubric_v1.md",
    "eval/chat01/rubrics/human_blind_rubric_v1.md",
    "eval/chat01/rubrics/blocker_rules_v1.json",
    "eval/chat01/rubrics/quality_rubric_v1.json"
  ],
  "freeze": {
    "hash_algorithm": "sha256",
    "manifest_hash_mode": "canonical_json_with_null_self",
    "immutable": true,
    "manifest_sha256": "f321c871e697b997f343f6b146bf2b85ccb3339d60ec421f036458e6c2397a9d"
  },
  "training_exclusions": [
    "eval/chat01/"
  ],
  "notes": "CHAT-01 v6 supersedes v5 for new work. All evaluation cases and rubrics are byte-identical to v5. v6 exists because the contract source 设计文档/AI聊天核心施工优先级总纲.md was updated (external edit); canonical sources are re-frozen at current state. The inherited leakage report only proves the unchanged evaluation text is isolated from the training inputs it scanned; FREEZE-02 must freeze and rescan the new approximately 1000-sample training corpus.",
  "frozen_assets": [
    {
      "path": "eval/chat01/schema/auto_result.schema.json",
      "bytes": 3202,
      "sha256": "c024ecd84a0b45461a7958c30620bd2737cd085c33065b444544e3925f0da7eb",
      "role": "schema"
    },
    {
      "path": "eval/chat01/schema/blocker_rules.schema.json",
      "bytes": 3054,
      "sha256": "224a5001ec70882157e38c920ad07ca5c41ce5b6929779b5b45759c251fc0fc2",
      "role": "schema"
    },
    {
      "path": "eval/chat01/schema/canon_drift.schema.json",
      "bytes": 3816,
      "sha256": "a562c109d4cb00966b2cb06f5143bf2eec477f60f5749c5c8c1d9b3bf29b9626",
      "role": "schema"
    },
    {
      "path": "eval/chat01/schema/canon_snapshot.schema.json",
      "bytes": 3045,
      "sha256": "f01faa89573518d825aa1d2878033771bb095bb36dedc58bfbf51b15ac7fc424",
      "role": "schema"
    },
    {
      "path": "eval/chat01/schema/case.schema.json",
      "bytes": 8240,
      "sha256": "8e2180f4db36478d824364c66e3f912e499038a358687d60ab57e9c016b4fe01",
      "role": "schema"
    },
    {
      "path": "eval/chat01/schema/human_ballot.schema.json",
      "bytes": 4509,
      "sha256": "0f3f3d5d789009da313fdf75961af7bc5354cb86df6b06f37bbe1f6bc84d0527",
      "role": "schema"
    },
    {
      "path": "eval/chat01/schema/leakage_report.schema.json",
      "bytes": 4517,
      "sha256": "969cb09433b099e01d493c15c8e88086725eb62250a6a7d69601a26168d9ae24",
      "role": "schema"
    },
    {
      "path": "eval/chat01/schema/quality_rubric.schema.json",
      "bytes": 2762,
      "sha256": "0c33a81d2866b0cbe95c40fbb2b0185e0bb6e3ffda5596dd94cae197f170a432",
      "role": "schema"
    },
    {
      "path": "eval/chat01/schema/semantic_review.schema.json",
      "bytes": 4376,
      "sha256": "40d0ff604253d4cfceaab5ed716f315c8da08e543736756f4e863381c9986c9c",
      "role": "schema"
    },
    {
      "path": "eval/chat01/schema/suite_manifest.schema.json",
      "bytes": 7096,
      "sha256": "769546b7f81598f057ca150bb88064bc82be6f8070e8059dadbe7a37a04c034d",
      "role": "schema"
    },
    {
      "path": "eval/chat01v5/change_notes.schema.json",
      "bytes": 3409,
      "sha256": "e1c4392e925c84847f687592d94ce67a7e12ead021579685008460983d891e50",
      "role": "schema"
    },
    {
      "path": "eval/chat01/suites/canon_drift_v3.json",
      "bytes": 1330,
      "sha256": "de65b3a15d9b2917f8064e7a0c7d7221c6bee39e5e82f2f24625fa376834ff19",
      "role": "suite"
    },
    {
      "path": "eval/chat01/suites/canon_snapshot_v4.json",
      "bytes": 2332,
      "sha256": "f3f29bfbd70d8c64d98f5739fc4139598cd5d9cb9f7cd76c0f58f62b8ef0bab4",
      "role": "suite"
    },
    {
      "path": "eval/chat01/suites/chat01_v6_change_notes.json",
      "bytes": 6446,
      "sha256": "5ede4c74343fe821af5035dff9bc1e8dbde906800b57dedf1b3049d21b1e5c7e",
      "role": "suite"
    },
    {
      "path": "eval/chat01/suites/chat01_dev_v1.jsonl",
      "bytes": 72386,
      "sha256": "f783e1f0112fdbb8e2b8d61080306806cb04b846de359382175e0e1465c24f5d",
      "role": "suite"
    },
    {
      "path": "eval/chat01/suites/chat01_frozen_multiturn_v1.jsonl",
      "bytes": 107277,
      "sha256": "a4f0058a701754d8ca7e46cbc32d60780b9eaf4c019a5cfd52342fba0c7033d6",
      "role": "suite"
    },
    {
      "path": "eval/chat01/suites/chat01_frozen_single_v1.jsonl",
      "bytes": 214501,
      "sha256": "a75f326a99cd83e77d795458b76cdcf93faae6d537d34cd02807c3f3afff3898",
      "role": "suite"
    },
    {
      "path": "eval/chat01/suites/chat01_human_blind_v1.jsonl",
      "bytes": 53810,
      "sha256": "cb2094cab0eb86fdacf6851a1b6ebbaeb08f8c268ff8ea37819be926e7f49966",
      "role": "suite"
    },
    {
      "path": "eval/chat01/rubrics/blocker_rules_v1.json",
      "bytes": 4228,
      "sha256": "1924a0b70277141923ec40bb2ba6a2adb09c21a87675df638a37b1140ab93893",
      "role": "rubric"
    },
    {
      "path": "eval/chat01/rubrics/human_blind_rubric_v1.md",
      "bytes": 2974,
      "sha256": "de3f38719f43da77d8b838538ab1b09c822bca9d834d9cd551aa3fb75ed3acf3",
      "role": "rubric"
    },
    {
      "path": "eval/chat01/rubrics/quality_rubric_v1.json",
      "bytes": 5209,
      "sha256": "fe2287e9b7378400affcc215f98f8e071a70fd95216e8a8e2f92ac4e146dd4e6",
      "role": "rubric"
    },
    {
      "path": "eval/chat01/rubrics/semantic_rubric_v1.md",
      "bytes": 3163,
      "sha256": "4c2ff651ed7b70d7125473ed37500969d003e24f4d328f91ac53ddf0456ede8d",
      "role": "rubric"
    },
    {